{
  "campaign_id": "anniversary_necklace_reveal",
  "audience": "Men buying a meaningful anniversary gift for a girlfriend or wife",
  "buyer_problem": "He's afraid the gift will feel generic, like he didn't put real thought into it.",
  "emotional_angle": "The relief and quiet pride of watching the message he wrote land before she even sees the necklace",
  "offer": "The ZAVIQU Signature Box: a customer-written message card revealed before the necklace inside",
  "campaign_objective": "conversion",
  "hook": "The card is what gets her, not the necklace.",
  "cta": "Create yours at ZAVIQU",
  "target_platforms": ["instagram_facebook"],
  "voiceover_requested": false,
  "rationale": "Leads with the message-card differentiator per brand_memory rather than the necklace itself, and answers the primary audience's real anxiety (looking thoughtless) rather than a generic 'buy jewelry' pitch. Single buyer problem, no voiceover requested in intake so none assumed here."
}
